{
  "instance_id": "44444444-4444-4444-8444-444444444444",
  "scope": {
    "owner_id": "11111111-1111-4111-8111-111111111111",
    "continuity_id": "55555555-5555-4555-8555-555555555555",
    "branch_id": "66666666-6666-4666-8666-666666666666"
  },
  "schema_version": "1.0.0",
  "resolved_at": "2026-09-05T00:00:00Z",
  "inputs": {
    "source_release_id": "33333333-3333-4333-8333-333333333333",
    "instance_revision": 2,
    "pins": {
      "schema_version": "1.0.0",
      "anatomy_preset_release_id": "88888888-8888-4888-8888-888888888888"
    }
  },
  "resolution_hash": "aaaaaaaaaaaaaaaaaaaaaaaaaaaaaaaaaaaaaaaaaaaaaaaaaaaaaaaaaaaaaaaa",
  "fields": {
    "identity.display_name": {
      "value": "Ada (undercover)",
      "knowledge_status": "known",
      "authority": "explicit_author",
      "supplied_by": "scenario_override"
    },
    "appearance.eye_color": {
      "value": "green",
      "knowledge_status": "known",
      "authority": "explicit_author",
      "supplied_by": "core",
      "lock_state": "locked"
    },
    "appearance.scar_count": {
      "knowledge_status": "unknown",
      "authority": "default",
      "supplied_by": "preset_default"
    }
  },
  "unresolved": [
    {
      "path": "anatomy.tail",
      "reason": "absent_structure"
    }
  ]
}
